{
  "title": "Staff Platform Architect",
  "must_have": [
    {
      "requirement_id": "req_python",
      "text": "Python"
    },
    {
      "requirement_id": "req_rest_api",
      "text": "REST API"
    }
  ],
  "nice_to_have": [
    {
      "requirement_id": "req_aws",
      "text": "AWS"
    }
  ],
  "responsibilities": [
    "Lead platform API architecture.",
    "Build Python REST services."
  ],
  "keywords": [
    "Staff Platform Architect",
    "Python",
    "REST API",
    "AWS"
  ]
}
