{
  "title": "Backend Engineer",
  "must_have": [
    {
      "requirement_id": "req_python",
      "text": "Python"
    },
    {
      "requirement_id": "req_rest_api",
      "text": "REST API"
    },
    {
      "requirement_id": "req_postgresql",
      "text": "PostgreSQL"
    }
  ],
  "nice_to_have": [
    {
      "requirement_id": "req_graphql",
      "text": "GraphQL"
    },
    {
      "requirement_id": "req_kafka",
      "text": "Kafka"
    }
  ],
  "responsibilities": [
    "Build Python REST APIs.",
    "Operate PostgreSQL-backed services."
  ],
  "keywords": [
    "Backend Engineer",
    "Python",
    "REST API",
    "PostgreSQL",
    "GraphQL",
    "Kafka"
  ]
}
